,,,,,,,,,,,,,
C0302883,,extremely rare,,extremely rare,0.28,incidence,weak,,,unknown,False,,SMITH DISEASE appears to be an extremely rare condition with limited documented cases in medical literature. Estimated <0.1 per 100k based on case report frequency. Confidence is low due to minimal epidemiological data and unclear disease boundaries.
C0333062,,,,,0.0,,none,,,unknown,False,,"Hernia sac is an anatomical descriptor of herniated tissue rather than a disease entity. It represents a pathological finding that occurs across multiple hernia types (inguinal, umbilical, femoral, etc.). Cannot estimate incidence as a standalone condition without specification of hernia type."
C0333133,,,,,0.0,,none,,,unknown,False,,"Mucus cast is a pathological finding or diagnostic observation, not a disease entity with clear incidence. Cannot meaningfully map to population-based epidemiology."
C0333294,,15.0,,1200000,0.55,incidence,moderate,Lanas A. (2005). Peptic ulcer disease. Semin Gastrointest Dis. 16(2):100-112,,moderate,False,,"Recurrent ulcers may refer to peptic ulcer disease or other recurrent ulcerations. Historical peptic ulcer incidence 60-80 per 100k; modern incidence significantly lower due to H. pylori treatment and PPIs, estimated 15-20 per 100k for recurrent cases. Term is somewhat nonspecific."
C0334229,,,,,0.0,,none,,,unknown,False,,Histological descriptor ('giant cell type') without organ/tissue specification; too broad and generic to map meaningfully. Giant cell tumors vary widely (benign fibroma vs malignant undifferentiated sarcoma).
C0334309,,8.5,,680000,0.5,incidence,moderate,,,moderate,True,Colorectal Cancer,Adenocarcinoma arising in pre-existing tubulovillous adenoma represents a subset of colorectal cancer incidence. Estimated at approximately 8-10% of colorectal cancer cases (~8.5 per 100k). Limited specific epidemiological data; confidence capped at 0.5 due to lack of dedicated registry data for this specific malignant transformation subtype.
C0334361,,1.2,,96000,0.55,incidence,moderate,,,moderate,True,Peritoneal Carcinoma,Serous surface papillary carcinoma (primary peritoneal carcinoma) estimated at ~1-1.5 per 100k based on cancer registry data. Often grouped with ovarian cancer; slight female predominance.
C0334369,,0.5,,40000,0.45,incidence,weak,,,moderate,True,Breast Carcinoma,"Comedocarcinoma is a rare form of breast cancer, estimated <1 per 100k overall."
C0334439,,1.5,,120000,0.68,incidence,moderate,Jambusaria-Pahlajani A et al. (2009). Desmoplastic melanoma: a systematic review. J Am Acad Dermatol. 60(4):S88-95,https://pubmed.ncbi.nlm.nih.gov/19211026/,moderate,True,Melanoma,Desmoplastic melanoma represents ~10-15% of melanomas with incidence ~1.5 per 100k. Specific histological subtype with distinct clinical features.
C0338483,,3.5,2500,280000,0.6,both,moderate,,,moderate,True,Migraine with aura,"Migraine with aura prevalence ~2-3%, prolonged aura subtype estimated ~3-4% of migraine population. Incidence ~3-4 per 100k person-years based on epidemiological studies."
C0338596,,2.5,1800,200000,0.75,both,strong,CDC Cerebral Palsy Data and Prevalence 2005,https://www.cdc.gov/ncbddd/cp/index.html,low,True,Cerebral palsy,Spastic CP is the most common form (~70-80% of CP cases). Incidence ~2-3 per 100k live births; prevalence ~1800 per 100k due to lifelong condition. Based on CDC and population registries.
C0339358,,2.0,,160000,0.65,incidence,moderate,Pediatric ophthalmology registries,,moderate,True,Cataract,Congenital/early-onset cataract. Infantile cataracts affect ~2-6 per 100k births based on pediatric ophthalmology data.
C0339383,,20.0,,1600000,0.45,incidence,weak,,,high,False,,Choroidal and/or chorioretinal disorder (umbrella term) incidence ~20 per 100k; includes various retinal conditions.
C0339682,,,4500,360000000,0.65,prevalence,moderate,"Optometry and Vision Science literature, prevalence studies of refractive errors",,moderate,True,Astigmatism,Corneal astigmatism is a subtype of regular astigmatism. Prevalence data shows approximately 45% of general population has some form of astigmatism; corneal specifically accounts for ~4500 per 100k.
C0340544,,2.0,,160000,0.5,incidence,moderate,,,moderate,True,Pulmonary arterial hypertension,"Drug-induced PAH (fenfluramine derivatives, dasatinib, others). Estimated ~2 per 100k based on pharmacovigilance and registry data, though varies by drug exposure."
C0340909,,0.8,,64000,0.4,incidence,weak,,,moderate,True,Arteriovenous fistula complications,Thrombosis of arteriovenous fistulas is a complication of dialysis access and vascular fistulas. Estimated ~0.8 per 100k based on dialysis population studies and fistula complication rates. Limited specific epidemiological data.
C0341047,,5.0,,400000,0.4,incidence,weak,,,moderate,True,Parotid Gland Disease,"Parotid hypertrophy can result from multiple causes (viral infection, autoimmune, lymphoma). Estimated incidence ~5 per 100k based on clinical presentation frequency, but highly heterogeneous etiology."
C0341823,,11.2,,896000,0.82,incidence,strong,GLOBOCAN 2005 (IARC); Ovarian cancer registry data showing epithelial subtype predominance,https://gco.iarc.fr/,moderate,True,Ovarian Cancer,Epithelial tumors comprise ~90% of ovarian cancers (most common histological type). Global ovarian cancer incidence ~11-12 per 100k (GLOBOCAN 2005). Using point estimate of 11.2 per 100k based on registry data. High prevalence of histological subtyping in cancer registries supports this estimate.
C0342410,,0.72,,57600,0.48,incidence,weak,,,unknown,False,,Rare autoimmune inflammation of pituitary gland. Estimated ~0.7 per 100k based on retrospective case series and hospital discharge data. Often underdiagnosed.
C0342611,,0.5,,40000,0.42,incidence,moderate,Lachmann HJ et al. (2002). Natural history and outcome in systemic AA amyloidosis. N Engl J Med. 346(23):1786-1795,https://pubmed.ncbi.nlm.nih.gov/12050336/,high,True,Hereditary amyloidosis,"Familial amyloidosis without neuropathy (including Finnish type, renal amyloidosis); estimated ~0.5 per 100k based on amyloidosis registries."
C0342777,,extremely rare,,extremely rare,0.3,incidence,weak,,,unknown,True,Mitochondrial respiration chain deficiency,"Rare mitochondrial disorder, <0.1 per 100k based on metabolic disease case registries. Very few cases reported globally."
C0342793,,extremely rare,,extremely rare,0.35,incidence,weak,,,unknown,False,,Extremely rare organic acidemia (metabolic disorder). Fewer than 50 reported cases worldwide. Estimated incidence <0.01 per 100k births based on case report frequency in metabolic disease literature.
C0344432,,3.5,,280000,0.58,incidence,moderate,,,moderate,True,Ventricular tachycardia,"Polymorphic VT is a specific arrhythmia subtype associated with acute coronary syndromes and channelopathies. Estimated 3-4 per 100k based on acute hospital cardiology data, but exact incidence poorly documented in epidemiological registries."
C0344516,,0.4,,32000,0.5,incidence,moderate,Congenital defect registries,,low,True,Coloboma,"Lens coloboma, rare congenital ocular anomaly. Part of coloboma spectrum, estimated ~0.4 per 100k births."
C0344772,,0.3,,24000,0.45,incidence,weak,,,unknown,True,Mitral valve anomalies,"Rare congenital cardiac anomaly, estimated ~0.3 per 100k births. Confidence limited by sparse epidemiological data; mostly documented through case reports and cardiac registry data rather than population-based surveillance."
C0345326,,,5000,400000000,0.65,prevalence,moderate,,,high,True,Phimosis,"Congenital phimosis measured as prevalence in male population. Reported in approximately 5% of uncircumcised male infants at birth (50,000 per 100k uncircumcised males)."
C0346027,,extremely rare,,extremely rare,0.2,incidence,weak,,,unknown,True,Eccrine sweat gland tumor,Very rare benign adnexal skin tumor arising from eccrine sweat gland tissue. <0.001 per 100k estimated from limited case series. No population-based epidemiological data available.
C0346304,,0.8,,64000,0.6,incidence,moderate,,,low,True,Pituitary adenoma,"Gonadotroph adenomas comprise ~10-15% of pituitary adenomas, which have incidence ~5-8 per 100k. Estimated ~0.8 per 100k based on proportion of adenoma subtypes."
C0346979,,,,,0.0,,none,,,unknown,True,Malignant neoplasm of bone marrow,Secondary malignancy of bone marrow lacks specific epidemiological data. Classified as subtype but no definitive incidence rates available in literature.
C0349198,,5.0,,400000,0.55,incidence,moderate,,,high,True,Psychotic disorder,Acute transient psychotic episodes show incidence around 5 per 100k person-years in community samples; wide variation due to diagnostic criteria differences and cultural factors in symptom recognition.
C0349554,,2.5,,200000,0.6,incidence,moderate,,,moderate,True,Vaginal intraepithelial neoplasia,"Vaginal intraepithelial neoplasia (VaIN) is rare, with total incidence ~2-3 per 100k. Grade 1 (low-grade) represents the majority of cases (~60-70%). Estimated ~2.5 per 100k based on VaIN epidemiology."
C0349555,,0.8,,64000,0.5,incidence,moderate,,,moderate,True,Vaginal intraepithelial neoplasia,Grade 2 (moderate dysplasia) represents a smaller proportion of VaIN cases (~20-30%). Estimated ~0.8-1.0 per 100k based on VaIN epidemiology and grade distribution.
C0375019,,20,800,64000000,0.6,both,moderate,WHO,,high,False,,"HTLV-I infection: global seroprevalence ~800 per 100k in endemic areas, much lower in non-endemic regions. Incidence of new infections ~20 per 100k in endemic areas."
C0375362,,1200,,96000000,0.62,incidence,moderate,"Liakakos T et al. (2001). Peritoneal adhesions: etiology, pathophysiology, and clinical significance. Dig Surg. 18(4):260-273",https://pubmed.ncbi.nlm.nih.gov/11528133/,low,False,,"Peritoneal adhesions develop in 60-90% of patients after abdominal surgery. With ~200 million surgeries globally/year, estimated ~1200 per 100k develop new adhesions annually."
C0375530,,12.0,,960000,0.72,incidence,strong,Birth defect registries and pediatric urology literature; incidence estimates from multiple cohort studies,,moderate,False,,Congenital UPJ obstruction is the most common cause of prenatally detected hydronephrosis. Incidence ~1 in 1000 to 1 in 1500 live births (varies by population and detection method). Using conservative estimate of ~1.2 per 1000 live births = ~12 per 100k total population. Often presents as prenatal finding.
C0392550,,25,,2000000,0.58,incidence,moderate,,,moderate,True,Hemiplegia,"Infantile hemiplegia (onset in infancy) often due to stroke, cerebral palsy, or congenital brain malformations. Estimated ~25 per 100k infants based on pediatric neurology studies."
C0393761,,1200,,96000000,0.35,incidence,weak,,,moderate,True,Insomnia,Middle insomnia (sleep maintenance difficulty) affects ~10-15% of adults; estimated new cases ~1200 per 100k annually. Incidence differs from prevalence; concept coherence moderate due to symptom-based definition.
C0398368,,2.5,,200000,0.35,incidence,weak,,,moderate,False,,"Aggregate umbrella term covering congenital lymphatic malformations, lymphedema, and lymphatic dysplasia. Estimated ~2.5 per 100k for congenital presentations. Heterogeneous category with variable clinical significance."
C0398561,,extremely rare,,extremely rare,0.25,incidence,weak,,,unknown,False,,Extremely rare inherited enzyme deficiency causing hemolytic anemia. Fewer than 50 documented cases worldwide. Incidence likely <0.01 per 100k. Confidence limited to case report evidence rather than systematic epidemiological surveillance.
C0399357,,7500,7500,600000000,0.55,prevalence,moderate,,,low,False,,"Talon cusp is a dental anomaly (extra cusps on anterior teeth). Prevalence estimated at 0.5-1.0% of population from dental literature, reported as ~7,500 per 100k. Measured as prevalence (anatomical variation)."
C0399379,,extremely rare,,extremely rare,0.3,prevalence,weak,,,unknown,True,Dentin Dysplasia,"Rare autosomal dominant dental anomaly, estimated prevalence <1 per 100,000 based on dental epidemiology case reports."
C0403477,,0.1,,8000,0.35,incidence,weak,,,high,True,Nephrocalcinosis,"Medullary nephrocalcinosis is associated with metabolic disorders (RTA, hypervitaminosis D, medullary sponge kidney). Rare condition with limited population-based incidence data; estimated <0.1 per 100k based on underlying condition frequencies."
C0403766,,0.8,,64000,0.45,incidence,weak,,,low,True,Phimosis,"Acquired phimosis develops in adulthood from trauma, balanitis, or infection. Estimated ~0.5-1 per 100k per year in adult male population based on urology literature, but limited epidemiological data."
C0403810,,,,,0.0,,none,,,unknown,False,,Unclear/unmappable concept. 'Oligosynaptic' (few synapses) is a neurobiological term unrelated to reproductive infertility. Possible data entry error or highly specialized terminology not found in standard epidemiological literature. Cannot map to incidence data.
C0406727,,extremely rare,,extremely rare,0.28,prevalence,weak,,,unknown,True,Orofaciodigital syndrome,Orofaciodigital syndrome (OFD) type 4 is a rare genetic syndrome. OFDs collectively affect <1 per 100k; type 4 is one of the rarest subtypes with <10 cases documented. Limited epidemiological data.
C0406756,,extremely rare,,extremely rare,0.2,,weak,,,unknown,False,,"Keratolytic winter erythema is an extremely rare genodermatosis with autosomal dominant inheritance. Only a few families documented in medical literature, estimated incidence <0.1 per 100k. Very limited epidemiological data available; confidence based on case report frequency."
C0410173,,0.5,,40000,0.35,incidence,weak,,,high,True,Autosomal Recessive Muscular Dystrophy,"Geographic variant of ARMD primarily in North African populations. Estimated incidence ~0.5 per 100k in endemic areas, much lower globally. Limited epidemiological data."
C0410334,,8500,,680000,0.3,incidence,weak,,,high,False,,"Aggregate BOTEC estimate summing major cartilage defects: osteoarthritis (~5000), chondromalacia patellae (~2000), osteochondritis dissecans (~800), cartilage injuries (~700) = ~8500 per 100k. Heterogeneous conditions with different etiologies."
C0431378,,extremely rare,5,extremely rare,0.35,prevalence,weak,,,low,True,Cortical Heterotopia,"Nodular heterotopia is a rare cortical malformation, mostly detected on neuroimaging in children with developmental delay or seizures. Estimated prevalence ~5 per 100k based on imaging studies."
C0431401,,extremely rare,,extremely rare,0.32,incidence,weak,,,unknown,False,,"Rare genetic syndrome characterized by cerebellar hypoplasia, developmental delay, and ocular abnormalities. Only a few hundred cases documented worldwide, estimated <0.01 per 100k."
C0431420,,extremely rare,,extremely rare,0.35,incidence,weak,,,unknown,True,Cerebral Aneurysm,Vein of Galen aneurysm is a rare congenital cerebrovascular lesion. Estimated <500 cases worldwide with incidence <0.01 per 100k births. Data from case reports and pediatric neurosurgery series.
C0431718,,5.0,,400000,0.55,incidence,moderate,International Society of Nephrology,,low,True,Renal Cystic Diseases,"Incidence of new-onset multiple renal cysts, including ADPKD and other polycystic kidney diseases, estimated ~5 per 100k population."
C0432238,,extremely rare,0.1,extremely rare,0.25,prevalence,weak,,,unknown,True,Skeletal Dysplasia,Rare skeletal dysplasia characterized by progressive bowing of long bones. Estimated <0.1 per 100k based on case reports in skeletal dysplasia registries.
C0432243,,extremely rare,,extremely rare,0.3,incidence,weak,,,unknown,True,Skeletal Dysplasia,"Rare genetic skeletal dysplasia with joint hypermobility, <100 reported cases worldwide, estimated <0.01 per 100k births."
C0432262,,extremely rare,,extremely rare,0.25,prevalence,weak,,,unknown,False,,Dysosteosclerosis is an extremely rare autosomal recessive skeletal dysplasia with fewer than 50 reported cases worldwide. Estimated <0.01 per 100k births.
C0432334,,extremely rare,,extremely rare,0.3,incidence,weak,,,unknown,True,Cutis laxa,"Genetic connective tissue disorder with multiple inherited forms (autosomal recessive, autosomal dominant, X-linked). Estimated <0.1 per 100k based on birth defect surveillance. Limited population-based incidence data."
C0432526,,extremely rare,,extremely rare,0.25,incidence,weak,,,unknown,True,Skin tumor,Rare benign skin tumor with limited epidemiological documentation. Estimated <0.01 per 100k based on dermatology case reports. No systematic population-based incidence studies available.
C0442872,,,,,0.0,,none,,,unknown,False,,"Umbrella term too vague and heterogeneous to estimate meaningfully. Cysts can occur in kidneys, ovaries, liver, lungs, brain, pancreas, and numerous other organs with vastly different etiologies and epidemiology. Cannot aggregate without organ specification."
C0442887,,,800.0,64000000,0.55,prevalence,weak,,,moderate,False,,"Broader umbrella term encompassing both pathologic (hypertrophic cardiomyopathy with asymmetric pattern) and physiologic ventricular septal thickening (athlete's heart, hypertension-related hypertrophy). Aggregate prevalence estimate ~8 per 1000 (800 per 100k) combining HCM and physiologic hypertrophy cases. Lower confidence due to heterogeneity and difficulty distinguishing pathologic from physiologic forms."
C0457521,,0.8,,64000,0.52,incidence,moderate,Reichart PA et al. (1995). Ameloblastoma: biological profile of 3677 cases. Eur J Cancer B Oral Oncol. 31B(2):86-99,https://pubmed.ncbi.nlm.nih.gov/7633291/,moderate,True,Ameloblastoma,"Unicystic ameloblastoma represents ~10-15% of all ameloblastomas. Total ameloblastoma incidence ~5 per 100k, unicystic variant ~0.8 per 100k based on oral pathology registries."
C0457531,,0.15,,12000,0.35,incidence,weak,,,unknown,True,Ameloblastoma,"Ameloblastoma is a rare odontogenic tumor, ~0.5-1 per million per year. Acanthomatous variant is a histological subtype with slightly higher frequency; estimated ~0.15 per 100k."
C0457949,,,50000,4000000000,0.75,prevalence,moderate,Global Burden of Disease Study,,moderate,True,Low Back Pain,Chronic low back pain reported as prevalence (~50% of adults experience chronic LBP at some point). WHO/epidemiological studies document high global prevalence; incidence is less well-defined due to recurrent/intermittent nature. Using prevalence metric appropriate for chronic pain conditions.
C0472802,,0.15,,12000,0.45,incidence,moderate,,,moderate,True,Hemophilia A,"Hemophilia A with inhibitor development is a subset (~25-30% of hemophilia A patients). Hemophilia A overall ~1 per 5,000 males. Inhibitor subset = ~0.15 per 100k. Confidence limited by difficulty distinguishing de novo vs acquired inhibitors."
C0473119,,1.2,,96000,0.55,incidence,moderate,,,moderate,True,Secondary bacterial peritonitis,Fecal peritonitis is acute secondary peritonitis from bowel perforation. Estimated incidence ~1.2 per 100k based on bowel perforation rates (1-3 per 100k) and proportion resulting in fecal peritonitis. Limited specific epidemiological studies; confidence capped at 0.55 due to uncertain attribution.
C0473574,,extremely rare,,extremely rare,0.15,,weak,,,unknown,True,Linear Verrucous Epidermal Nevus,Extremely rare congenital skin condition with no systematic epidemiological data. Estimated <0.01 per 100k based on isolated case reports and limited dermatology literature. Confidence very low due to lack of population-based data.
C0473577,,0.5,,40000,0.38,incidence,weak,,,unknown,False,,Eccrine nevus is rare benign hamartoma of eccrine sweat glands. Estimated ~0.5 per 100k based on dermatology case series.
C0473579,,0.1,,8000,0.28,incidence,weak,,,unknown,True,Eccrine nevus,PEODDN is extremely rare variant of eccrine nevus with porokeratotic features. Estimated ~0.1 per 100k based on <100 reported cases in dermatology literature.
C0475811,,500,,40000000,0.28,incidence,weak,,,high,False,,"Aggregate BOTEC estimate summing major keratinization disorders: psoriasis (~200), ichthyosis (~100), keratosis pilaris (~150), pityriasis rubra pilaris (~50) = ~500 per 100k. Umbrella term with heterogeneous etiologies and incidence."
C0477474,,,24500,1960000000,0.82,prevalence,strong,WHO Global Burden of Disease 2005 report on skin conditions,https://www.who.int/,moderate,False,,"Dermatitis and eczema are chronic inflammatory conditions; prevalence is the appropriate metric. Global prevalence estimated at 2.45% of population (24,500 per 100k) based on WHO epidemiological data. Includes atopic dermatitis and other forms."
C0477972,,1.2,,96000,0.5,incidence,moderate,,,moderate,True,Congenital brain malformations,This category includes various specified congenital brain malformations. Birth prevalence of central nervous system anomalies ranges from 1-5 per 1000 live births; specified brain malformations excluding common types estimated at 1.0-1.5 per 100k.
C0489980,,0.5,,40000,0.35,incidence,weak,,,high,True,Mycobacterial Infection,"Disseminated non-tuberculous mycobacterial (NTM) infections rare, incidence ~0.5-2 per 100k globally. Primarily in immunocompromised patients. WHO surveillance data limited for non-TB mycobacteria."
C0496870,,15000,,1200000000,0.25,incidence,weak,,,high,False,,"Aggregate BOTEC estimate summing major benign liver tumors: hemangiomas (5000-10000 per 100k on imaging), adenomas (0.1-0.5 per 100k incidence), focal nodular hyperplasia (common, ~5000 per 100k). Total ~15000 per 100k. Low confidence due to heterogeneity between benign entities with vastly different clinical significance and prevalence."
C0521573,,0.3,,24000,0.45,incidence,weak,,,low,True,Coloboma,"Rare eyelid coloboma, subset of ocular colobomas. Estimated ~0.3 per 100k births based on limited congenital defect registries."
C0521720,,,500,,0.4,prevalence,weak,,,high,False,,"Corneal fibrosis is a pathological outcome rather than a primary disease entity. It results from various underlying causes (ocular trauma, chemical burns, infection, refractive surgery, etc.). Prevalence estimates ~0.5-1% of population based on ophthalmology clinic surveys and low-income country data where corneal scarring is more common. Cannot establish meaningful incidence without specifying etiology."
C0543641,,0.8,,64000,0.45,incidence,weak,,,unknown,True,Megaloblastic anemia,"Secondary megaloblastic anemia is a rare complication of B12 deficiency, drug toxicity, or GI disorders. Estimated incidence ~0.8 per 100k based on hospital discharge data and hematology literature."
C0544840,,0.3,,24000,0.35,incidence,weak,,,unknown,True,Amyloidosis,Systemic amyloidosis overall ~0.5-1 per 100k. Nodular (cutaneous) form is subset of localized amyloidosis. Estimated ~0.3 per 100k based on case frequency relative to systemic forms.
C0544848,,extremely rare,,extremely rare,0.3,prevalence,weak,,,high,True,Corneal Dystrophy,"Granular corneal dystrophy (GCD) is a rare inherited disorder affecting corneal clarity. Prevalence estimated 1-2 per 100,000 in populations with high gene carrier frequency, but generally <0.5 per 100k globally."
C0549118,,extremely rare,,extremely rare,0.25,incidence,weak,,,unknown,False,,"Rare genetic syndrome combining hemiplegia, hemiconvulsion, and epilepsy (HHE). Fewer than 100 cases reported in literature globally. Often autosomal dominant inheritance with PCDH19 or other genetic mutations. Incidence <0.001 per 100k based on case report frequency."
C0559459,,3.5,,280000,0.65,incidence,moderate,"Horton WA (1998). Pediatric Clinics of North America, 45(3), cited in congenital anomaly surveys",,low,True,Congenital teratoma,"Sacrococcygeal teratoma (SCT) is one of the most common congenital tumors. Incidence approximately 1 in 20,000 to 1 in 40,000 live births (3-5 per 100k). Moderate confidence due to limited recent epidemiological studies."
C0575059,,,,,0.0,,none,,,unknown,False,,"Spastic tetraparesis is a clinical symptom/syndrome rather than a disease entity. It presents in multiple distinct conditions (cerebral palsy, spinal cord injury, multiple sclerosis) with vastly different epidemiologies. Too broad and heterogeneous to map meaningfully."
C0581381,,2500,,200000000,0.35,incidence,weak,,,moderate,True,Upper Respiratory Tract Infection,"Recurrent URTIs represent a clinical pattern of repeated upper respiratory infections, primarily affecting children (<12 years) and immunocompromised individuals. Incidence highly variable depending on definition of 'recurrent' (typically 3-8+ episodes per year). Aggregate estimate ~2500 per 100k based on pediatric prevalence of frequent respiratory infections. Confidence limited by vague concept definition."
C0585955,,2.5,,200000,0.45,incidence,moderate,,,low,False,,"Laryngeal dysplasia comprises multiple congenital laryngeal abnormalities (webs, stenosis, clefts). Estimated incidence ~2-3 per 100k live births based on pediatric otolaryngology literature. More common than ultra-rare genetic syndromes but data quality remains limited."
C0588006,,300,25000,24000000,0.62,both,moderate,,,high,True,Major Depressive Disorder,"Mild depression is a subtype. Using prevalence (~2.5% of population, or 25000 per 100k) and incidence (~300 per 100k for new mild episodes). Significant variation by definition and diagnostic criteria."
C0678128,,,,,0.1,,none,,,unknown,False,,Friend leukemia is primarily known as a mouse model disease induced by Friend virus; human epidemiological data not found in medical literature.
C0678329,,,,,0.0,,none,,,unknown,False,,"Not a well-defined disease entity. Drug substitution is a behavioral descriptor related to substance abuse patterns, not a clinically distinct disease diagnosis that can be meaningfully epidemiologically mapped."
