,,,,,,,,,,,,,
C3554079,,extremely rare,,extremely rare,0.25,incidence,weak,,,unknown,True,Mitochondrial disease,Combined oxidative phosphorylation deficiency 12 (COXPD12) is an extremely rare autosomal recessive mitochondrial disorder. Overall mitochondrial disease incidence is 1-5 per 100k. COXPD12 is a specific genetic subtype with very limited case reports globally (<10-20 known cases). Incidence estimated <0.01 per 100k births based on case frequency and genetic epidemiology.
C3554168,,extremely rare,,extremely rare,0.2,incidence,weak,,,unknown,True,Mitochondrial Respiratory Chain Disorder,"Rare mitochondrial disorder affecting oxidative phosphorylation. Type 14 is one of multiple genetic subtypes with <100 total cases, <0.01 per 100k."
C3554182,,extremely rare,,extremely rare,0.25,incidence,weak,,,unknown,True,Mitochondrial Oxidative Phosphorylation Deficiency,COXPD15 is an extremely rare mitochondrial disorder affecting complex I-IV assembly. Fewer than 50 cases reported globally in medical literature. Incidence estimated <0.01 per 100k births.
C3554209,,extremely rare,,extremely rare,0.2,incidence,weak,,,unknown,True,Pontocerebellar Hypoplasias,PCH8 is one of >10 specific genetic subtypes of pontocerebellar hypoplasia. Extremely rare congenital neurological disorder with fewer than 100 reported cases globally. Autosomal recessive inheritance with heterogeneous mutations. Incidence <0.01 per 100k births.
C3554224,,extremely rare,,extremely rare,0.3,incidence,weak,,,unknown,False,,Congenital leptin deficiency (LEPOB) is an extremely rare autosomal recessive genetic disorder with fewer than 100 cases reported worldwide. Leptin dysfunction encompasses mutations in leptin or its receptor (LEPR). Estimated <0.01 per 100k based on genetic disease frequency databases.
C3554235,,extremely rare,,extremely rare,0.25,incidence,weak,,,unknown,True,Joubert Syndrome,"Joubert syndrome type 20 is an extremely rare cerebellar disorder with autosomal recessive inheritance. Joubert syndrome overall has estimated incidence of <1 per 100k, with type 20 being a rare subtype."
C3554428,,extremely rare,,extremely rare,0.25,incidence,weak,Case reports and medical literature; OI registries,,unknown,True,Osteogenesis imperfecta,Osteogenesis imperfecta (all types) ~0.6 per 100k births. Type XIV is one of the rarest subtypes with only a handful of reported cases worldwide. <0.01 per 100k estimated.
C3554439,,extremely rare,,extremely rare,0.2,incidence,weak,,,unknown,True,Microcephalic Primordial Dwarfism,"Microcephalic primordial dwarfism Alazami type is an extremely rare autosomal recessive genetic disorder. Microcephalic primordial dwarfism overall incidence approximately 1 per million births (<0.01 per 100k), with Alazami type being one of multiple rare subtypes. No systematic epidemiological data available."
C3554478,,extremely rare,,extremely rare,0.25,incidence,weak,,,unknown,True,Osteopetrosis,Autosomal recessive osteopetrosis type 8 is a rare skeletal dysplasia with <100 cases worldwide. Estimated <0.01 per 100k births based on case frequency.
C3554592,,extremely rare,,extremely rare,0.25,incidence,weak,,,unknown,True,Microphthalmia with Coloboma,"Rare congenital eye condition. Microphthalmia with coloboma (specific types) estimated at <1 per 100,000 births. This specific phenotype (COLOBOMA 9) represents a rare genetic variant. Limited published epidemiological data; mostly case reports and small clinical series."
C3554689,,extremely rare,0.05,4000,0.2,prevalence,weak,,,unknown,True,X-linked Agammaglobulinemia,Rare form of Bruton-like immunodeficiency. Very few cases reported globally. Prevalence <0.05 per 100k.
C3697137,,extremely rare,,extremely rare,0.25,,weak,Case reports and case series in medical literature,,unknown,True,Fibrous Dysplasia,"Fibrous dysplasia of bone is rare (~1 per 4000-40000). When combined with intramuscular myxoma (Mazabraud syndrome), this represents an extremely rare genetic condition with <200 cases reported worldwide. Estimated <0.01 per 100k births. Limited epidemiological literature."
C3697269,,extremely rare,,extremely rare,0.3,incidence,none,,,unknown,False,Chromosomal abnormality,15q24 microdeletion is a rare genetic disorder. Fewer than 100 cases reported worldwide. No systematic epidemiological data available; confidence capped at 0.3 due to absence of population-based incidence estimates.
C3698357,,2.0,,160000,0.4,incidence,weak,,,moderate,True,Myoclonic epilepsy,Treatment-resistant myoclonic epilepsy. Represents subset of myoclonic epilepsy cases (~30-40%). Estimated ~2 per 100k based on epilepsy registries.
C3714731,,500,28000,2240000000,0.72,prevalence,strong,WHO Global Oral Health Data Bank; multiple epidemiological surveys,,high,True,Dental caries,Early childhood caries (ECC) affects ~28% of preschool-age children globally. Reported as prevalence since it's a chronic condition. Incidence data limited but prevalence well-documented.
C3714744,,2000,,160000000,0.25,incidence,weak,,,high,False,,"Psychosexual dysfunction is broad symptom category affecting 10-30% of adults. Estimated new cases ~2000 per 100k annually. Concept coherence low; heterogeneous etiologies (psychological, medical, relational)."
C3714844,,0.5,,40000,0.35,incidence,weak,,,unknown,True,"Pulmonary Hypertension, Primary",Extremely rare genetic subtype of primary pulmonary hypertension associated with hereditary hemorrhagic telangiectasia (HHT). Limited epidemiological data; estimated <0.5 per 100k based on HHT prevalence (~1-2 per 100k) and frequency of pulmonary involvement.
C3714896,,extremely rare,,extremely rare,0.25,incidence,weak,,,unknown,True,Smith-Mccort Dysplasia,Extremely rare autosomal recessive skeletal dysplasia with dwarfism and brachydactyly. Fewer than 100 cases worldwide reported. Type 2 variant of Smith-Mccort dysplasia.
C3714897,,extremely rare,,extremely rare,0.25,prevalence,none,,,unknown,True,Spastic paraplegia,"Ultra-rare genetic disorder (SPG57, autosomal recessive). Only handful of cases reported in medical literature. Estimated <0.001 per 100k. Specific genetic subtype with extremely limited prevalence data."
C3714980,,0.6,,48000,0.4,incidence,weak,,,moderate,True,Bardet-Biedl Syndrome,Specific genetic form of Bardet-Biedl Syndrome. BBS overall incidence ~0.5-1 per 100k births. Type 17 represents subset of total cases. Estimated ~0.6 per 100k births based on genetic population studies.
C3804969,,800,,64000000,0.52,incidence,moderate,,,moderate,False,,Dysgnathia (jaw size/position abnormalities) encompasses malocclusion and skeletal jaw discrepancies. Estimated ~800 per 100k based on orthodontic epidemiology studies showing significant malocclusion in ~8% of population.
C3806403,,extremely rare,,extremely rare,0.25,incidence,weak,,,unknown,False,Epilepsy,"Continuous spike-wave activity in slow sleep (CSWS/electrical status epilepticus in sleep, ESES) is a rare EEG pattern associated with severe childhood epilepsy. Estimated <0.5 per 100k children based on case reports."
C3806745,,extremely rare,,extremely rare,0.2,,weak,,,unknown,True,Palmoplantar Keratoderma,"Extremely rare X-linked genetic skin disorder with mutilating palmoplantar keratoderma and periorificial plaques. Very specific phenotype with estimated <50 known cases worldwide, <0.001 per 100k incidence. Lacks systematic epidemiological studies."
C3808553,,extremely rare,,extremely rare,0.3,incidence,weak,,,unknown,True,Bone marrow failure syndrome,Specific genetic subtype of bone marrow failure. <0.1 per 100k based on molecular genetics case series.
C3808920,,extremely rare,,extremely rare,0.25,incidence,weak,,,unknown,True,Hereditary Sideroblastic Anemia,"Rare genetic iron metabolism disorder, likely related to mitochondrial dysfunction. Fewer than 100 families documented worldwide. <0.01 per 100k incidence."
C3808988,,0.01,,800,0.25,incidence,weak,,,unknown,True,Fanconi Anemia,Fanconi anemia overall incidence ~1-2 per million live births. FA-Q is one of 22 complementation groups; extremely rare subtype with <10 families reported globally. Estimated <0.01 per 100k.
C3808991,,0.08,,6400,0.35,incidence,weak,,,unknown,False,,NGLY1 deficiency is ultra-rare congenital disorder of deglycosylation with multisystem involvement. Estimated <0.1 per 100k based on genetic databases with <100 reported cases worldwide.
C3809013,,extremely rare,,extremely rare,0.25,incidence,weak,,,unknown,True,Cortical Dysplasia,"Very rare genetic brain malformation disorder. Estimated <1 per 100,000 births based on pediatric neurology case series. Complex cortical dysplasia with multiple brain malformations type 2 is a specific genetic form with limited epidemiological data."
C3809352,,extremely rare,,extremely rare,0.25,incidence,weak,,,unknown,True,Meckel Syndrome,Meckel syndrome type 11 is an extremely rare genetic disorder with autosomal recessive inheritance. Fewer than 50 cases reported worldwide in medical literature. Estimated at <0.01 per 100k births.
C3809394,,extremely rare,,extremely rare,0.15,incidence,weak,,,unknown,True,Dyschromatosis Universalis Hereditaria,"Rare genetic pigmentation disorder (DUH type 3). Extremely rare autosomal recessive condition, <0.01 per 100k based on limited case reports."
C3809522,,0.12,,9600,0.32,incidence,weak,,,unknown,False,,ILFS1 is rare genetic disorder causing acute infantile liver failure. Estimated ~0.12 per 100k births based on pediatric hepatology case series.
C3809536,,0.2,,16000,0.35,incidence,weak,,,low,True,"Ventricular Tachycardia, Catecholaminergic Polymorphic","CPVT type 5: rare cardiac genetic condition, <0.5 per 100k estimated."
C3809672,,extremely rare,,extremely rare,0.2,prevalence,weak,,,unknown,True,"Mental Retardation, Autosomal Recessive",Extremely rare autosomal recessive genetic disorder (ARID37). Distinct molecular entity with specific genetic basis. No published epidemiological studies; estimated prevalence <0.01 per 100k based on case reports only.
C3809768,,extremely rare,,extremely rare,0.25,incidence,weak,,,unknown,True,Primary Immunodeficiency Disorders,Rare genetic immunodeficiency disorder; estimated <0.01 per 100k based on genetic disorder prevalence. Limited epidemiological data available.
C3809811,,0.05,,4000,0.25,incidence,weak,,,unknown,True,Juvenile Parkinson disease,PARK19A is extremely rare juvenile-onset Parkinson. Estimated <0.1 per 100k based on limited genetic case reports.
C3810080,,extremely rare,,extremely rare,0.22,prevalence,weak,,,unknown,True,Autosomal Recessive Intellectual Disability,"Rare monogenic form of autosomal recessive intellectual disability (ARID40). Extremely rare genetic condition, prevalence likely <0.1 per 100k population. Limited case reports; assigned prevalence metric as intellectual disabilities are lifelong chronic conditions."
C3810225,,extremely rare,,extremely rare,0.15,incidence,weak,,,unknown,True,"Intellectual Disability, Autosomal Recessive",Extremely rare genetic condition with autosomal recessive inheritance. Estimated at <0.01 per 100k based on limited case reports. No systematic epidemiological studies available.
C3810359,,0.3,,24000,0.35,incidence,weak,,,low,True,Renal Dysplasia,Rare congenital genetic variant of renal dysplasia. Limited epidemiological data; estimate based on overall renal dysplasia incidence (~3 per 100k) with this specific genetic form comprising ~10% of cases.
C3825452,,50.0,8000,640000000,0.75,prevalence,strong,WHO geriatric mental health epidemiology,,moderate,True,Major Depressive Disorder,Late-life depression (age 65+) affects ~8% of elderly population. Using prevalence metric appropriate for chronic psychiatric condition.
C3826233,,,150,12000000,0.55,prevalence,moderate,,,high,True,Hearing Impairment,Prevalence of childhood hearing impairment estimated at 150 per 100k children based on WHO epidemiological estimates and regional studies.
C3828464,,1.2,,96000,0.55,incidence,moderate,"Parkin DM et al. (2005). Global cancer statistics, 2002. CA Cancer J Clin. 55(2):74-108",https://pubmed.ncbi.nlm.nih.gov/15761078/,moderate,True,Glioblastoma,"Proneural is a molecular subtype of glioblastoma (Phillips classification). Glioblastoma global incidence ~3.8 per 100k (GLOBOCAN 2005). Proneural represents 25-30% of cases, estimated ~1.2 per 100k. Confidence limited by incomplete epidemiological characterization of molecular subtypes."
C3838965,,extremely rare,,extremely rare,0.2,incidence,weak,,,unknown,True,Stromal Tumor,"Extremely rare stromal tumor variant, fewer than 50 cases reported globally. Estimated <0.01 per 100k based on case report literature."
C3854181,,,300,24000000,0.35,prevalence,weak,,,low,False,,Nevus sebaceous is a benign hamartoma present at birth in approximately 0.3% of newborns. Reported as prevalence rather than incidence since it's a congenital lesion. Limited dermatology literature on prevalence estimates. Confidence moderate-low due to limited epidemiological data.
C3875046,,0.5,5,400000,0.4,both,weak,,,low,True,Nephrogenic Diabetes Insipidus,Partial NDI is a rare form with milder symptoms. NDI overall estimated 5 per 100k; partial form represents subset. Limited epidemiological data.
C3887523,,extremely rare,,extremely rare,0.3,incidence,weak,,,high,True,Fatty acid oxidation disorders,"VLCAD deficiency is a rare mitochondrial fatty acid oxidation disorder. Estimated incidence 1 in 40,000 to 1 in 100,000 births globally, approximately 0.01-0.025 per 100k births. Limited epidemiological data available; primarily identified through newborn screening programs in developed countries."
C3887755,,100000,,8000000000,0.3,incidence,weak,,,high,False,Environmental Illness,"Acute mountain sickness (AMS) incidence varies dramatically by altitude and individual susceptibility (25-50% at 2500m, 50%+ at 3500m). Aggregate BOTEC estimate of ~100,000 per 100k based on exposure rates in high-altitude mountaineering, trekking, and geographic populations. Incidence depends heavily on exposure frequency, making population-level estimate highly uncertain."
C3888002,,0.1,,8000,0.25,incidence,weak,,,unknown,True,Pulmonary Hypertension,"Pulmonary hypertension primary type 2 (PHT2/BMPR2-related) is a rare genetic subtype. Estimated ~0.1 per 100k incidence, represents small fraction of heritable pulmonary hypertension cases."
C3888085,,extremely rare,,extremely rare,0.2,incidence,none,,,unknown,True,Congenital Anomalies,"Rare compound congenital condition combining pancreatic agenesis (<0.001 per 100k births) with cardiac defects, fewer than 50 cases in medical literature."
C3888087,,0.1,,8000,0.35,incidence,weak,,,unknown,True,Charcot-Marie-Tooth disease type 2,CMT2I is rare genetic subtype of axonal CMT. Estimated ~0.1 per 100k based on CMT genetic registries.
C3888355,,extremely rare,,extremely rare,0.35,incidence,weak,,,unknown,True,Genetic Deafness,"Extremely rare autosomal recessive deafness subtype (DFNB93), documented in only a few families worldwide. Estimated <0.01 per 100k based on genetic deafness literature."
C3890422,,0.8,,64000,0.35,incidence,weak,,,high,False,,"Post-treatment Lyme disease syndrome (PTLDS) is a controversial condition with estimated incidence ~0.8 per 100k based on CDC case reports, but diagnosis and incidence are debated. Limited to subset of Lyme disease cases."
C3898765,,6.0,,480000,0.6,incidence,moderate,WHO ocular disease surveillance,,high,True,Infectious Keratitis,"Broader category of infectious keratitis (bacterial, viral, fungal). Estimated ~6 per 100k based on ophthalmology registries."
C4014616,,0.05,,4000,0.22,incidence,weak,,,unknown,True,Hereditary hypotrichosis,HYPT13 is rare genetic subtype of hereditary hair loss. Estimated <0.1 per 100k based on genetic databases and case reports.
C4014745,,extremely rare,,extremely rare,0.2,,none,,,unknown,True,Autosomal Recessive Mental Retardation,Extremely rare genetic condition (AR-MR44). No systematic epidemiological data available. Estimated <0.01 per 100k births based on genetic disorder prevalence patterns.
C4014821,,extremely rare,,extremely rare,0.2,,weak,,,unknown,False,,"Rare multi-system genetic syndrome combining cerebellar ataxia, intellectual disability, oculomotor apraxia, and cerebellar cysts. Extremely rare with <0.01 per 100k prevalence. Likely monogenic or oligogenic inheritance. No systematic epidemiological studies found."
C4014934,,extremely rare,,extremely rare,0.15,incidence,weak,,,unknown,True,Primary Immunodeficiency,Rare genetic immunodeficiency. <10 cases reported. <0.01 per 100k incidence.
C4015283,,extremely rare,,extremely rare,0.22,prevalence,weak,,,unknown,True,Autosomal Recessive Intellectual Disability,"Rare monogenic form of autosomal recessive intellectual disability (ARID46). Extremely rare genetic condition, prevalence likely <0.1 per 100k population. Limited case reports; assigned prevalence metric as intellectual disabilities are lifelong chronic conditions."
C4015293,,extremely rare,,extremely rare,0.25,incidence,weak,,,unknown,False,,"Rare genetic immunodeficiency disorder with neurological manifestations. Extremely rare, likely <0.01 per 100k based on case report frequency. No systematic epidemiological data available."
C4015542,,0.1,,8000,0.32,incidence,weak,,,unknown,True,Nephronophthisis,NPHP19 is rare genetic subtype of nephronophthisis (ciliopathy). Estimated ~0.1 per 100k based on genetic database and case reports.
C4015729,,extremely rare,,extremely rare,0.15,,weak,,,unknown,True,Peeling Skin Syndrome,"Rare genetic ichthyotic disorder, PSS3 (autosomal recessive) with <50 cases reported in literature, <0.01 per 100k births."
C4020689,,150,,12000000,0.65,incidence,moderate,,,moderate,True,Polydactyly,Congenital malformation (extra digits). Global incidence ~1.5 per 1000 births (150 per 100k) based on birth defect registries. Varies by ethnicity and geography.
C4020778,,,8500,680000000,0.65,prevalence,moderate,International Diabetes Federation. Diabetes and Pregnancy. World Diabetes Congress 2005-2015,,high,False,,"Maternal hyperglycemia prevalence (gestational diabetes + pre-existing diabetes in pregnancy) estimated at 8.5% of pregnancies globally (~8,500 per 100k pregnant women). Measured as prevalence rather than incidence due to condition occurrence during specific pregnancy period."
C4020827,,0.5,,40000,0.65,incidence,moderate,WHO fact sheet on hemolytic disease of newborns,,moderate,True,Hemolytic Anemia,"Hemolytic disease of newborn (HDN) incidence ~0.3-0.5 per 100k live births due to Rh incompatibility and ABO mismatch, declining due to RhIG prophylaxis."
C4021084,,0.15,,12000,0.3,incidence,weak,,,unknown,False,,Optic nerve aplasia is an extremely rare congenital malformation. Estimated <0.2 per 100k births based on case report frequency and pediatric ophthalmology registries. Limited epidemiological data available.
C4021765,,,,,0.0,,none,,,unknown,False,,"Umbrella term too broad and generic to estimate meaningfully. Encompasses vast heterogeneous group of CNS malformations, lesions, and structural abnormalities with vastly different incidence rates."
C4021789,,5.0,,400000,0.35,incidence,weak,,,moderate,False,,"Vertebral column abnormalities encompass multiple etiologies (congenital, degenerative, traumatic). Estimated ~5 per 100k based on birth defect registries and structural malformations. Confidence limited due to heterogeneity and variable definitions."
C4021812,,45,,3600000,0.28,incidence,weak,,,high,False,,"Aggregate BOTEC estimate for congenital head abnormalities summing major categories: cleft palate/lip (~1.5 per 1000 births), hydrocephalus (~0.5 per 1000), microcephaly/anencephaly (~0.5 per 1000), other craniofacial abnormalities (~1.5 per 1000) = ~45 per 100k live births. High heterogeneity and geographic variation in congenital prevalence."
C4021817,,,,,0.0,,none,,,unknown,False,,"Umbrella term too broad and heterogeneous to estimate meaningfully. Encompasses hundreds of distinct congenital and acquired conditions (cleft palate, thyroid disorders, neck masses, developmental anomalies) with vastly different epidemiology. Would require specification of specific condition type."
C4024809,,extremely rare,,extremely rare,0.2,incidence,weak,,,unknown,False,Retinal Dysplasia,Rare congenital retinal condition affecting the choroid and retina. Part of rare developmental eye anomalies. Fewer than 100 cases reported globally. Very limited epidemiological data.
C4025218,,3.2,,256000,0.45,incidence,weak,,,high,False,,"Large vessel vasculitis umbrella term includes Takayasu's arteritis (~0.4 per 100k), temporal/giant cell arteritis (~17 per 100k in elderly >50yrs, ~3 per 100k overall population weighted average), and polymyalgia rheumatica. Aggregate BOTEC estimate ~3.2 per 100k population-weighted. Low confidence due to heterogeneity and dramatic age-related variation."
C4039473,,extremely rare,,extremely rare,0.25,incidence,weak,,,unknown,True,3-methylglutaconic aciduria,Extremely rare autosomal recessive metabolic disorder. Type 5 is one of multiple genetic subtypes with very limited epidemiological data. Estimated <0.01 per 100k based on rare case reports.
C4040907,,35.0,,2800000,0.65,incidence,moderate,,,low,True,Turner syndrome,"Turner syndrome overall incidence ~100-150 per 100,000 live births (1-2 per 1000 births). Mosaic Turner syndrome represents 15-25% of Turner syndrome cases (karyotypic mosaicism). Estimated mosaic form incidence ~35 per 100k. Note: this is birth incidence for live births, not general population incidence."
C4041147,,150,,12000000,0.55,incidence,moderate,,,high,True,Chronic obstructive pulmonary disease,Acute exacerbation events occurring in COPD/chronic obstructive bronchitis patients. Estimated ~150 per 100k based on COPD prevalence (400+ per 100k globally) with ~30-40% experiencing exacerbations annually. Confidence moderate due to being acute manifestation of chronic disease.
C4042906,,0.02,,1600,0.4,incidence,weak,,,unknown,False,,Mammary analogue secretory carcinoma is an extremely rare malignancy occurring in salivary glands and other sites. Estimated <0.02 per 100k based on limited case reports. Note: C4330658 appears to be a more specific subtype of this condition.
C4048549,,4.5,,360000,0.72,incidence,strong,GLOBOCAN 2005 (IARC),https://gco.iarc.fr/,moderate,True,Germ cell tumor,"Testicular and ovarian germ cell cancers with documented incidence from cancer registries. Global estimate ~4.5 per 100k, mainly testicular cancers in males with peak age 20-40."
C4049090,,,25000,2000000000,0.65,prevalence,moderate,,,moderate,True,Androgenetic alopecia,"Androgenetic alopecia (androgenetic alopecia locus 1) is the most common form of hair loss. Prevalence estimated at ~25% of global population, higher in males (~40-50%) and lower in females (~20-30%), with age-dependent increases. Using prevalence metric as this is a chronic, lifelong condition without clear incidence."
C4049279,,45.0,,3600000,0.6,incidence,moderate,Grysiewicz RA et al. (2008). Stroke epidemiology: the magnitude of the problem. In: Handbook of Clinical Neurology,,high,True,Epilepsy,Post-stroke epilepsy incidence estimated at ~45 per 100k person-years based on stroke incidence (~300 per 100k) and seizure risk post-stroke (~10-15%). Limited epidemiological data specific to global incidence.
C4049638,,0.8,,64000,0.4,incidence,weak,,,moderate,True,Small Vessel Vasculitis,"Cutaneous small vessel vasculitis is a rare form of systemic vasculitis. Estimated incidence approximately 0.8-1.2 per 100k based on dermatological literature, but limited epidemiological data available."
C4053736,,0.8,,64000,0.35,incidence,weak,,,unknown,True,Catecholaminergic Polymorphic Ventricular Tachycardia,"CPVT Type 1 (RYR2 mutations) is the primary form of catecholaminergic polymorphic ventricular tachycardia, a rare genetic cardiac arrhythmia. Prevalence estimates range 1 per 10,000 to 1 per 1,000,000 depending on ascertainment. Conservative estimate ~0.8 per 100k based on genetic disease frequency and case series data."
C4054188,,0.3,,24000,0.55,incidence,moderate,ALL molecular subtyping studies and GLOBOCAN data,,low,True,Acute Lymphoblastic Leukemia,"Ph-negative ALL with BCR-ABL-like molecular features comprises ~10-15% of ALL cases. Using ALL incidence of ~2-3 per 100k, Ph-like represents approximately 0.2-0.5 per 100k. Confidence limited by reliance on molecular subtyping data from specialized centers."
C4055018,,0.05,,4000,0.35,incidence,weak,,,moderate,True,Hemolytic Uremic Syndrome,Rare genetic form of HUS affecting <0.1% of HUS cases; estimated ~0.05 per 100k based on registry data from specialized nephrology centers.
C4073145,,50.0,,,0.65,prevalence,moderate,,,moderate,False,Keratosis Pilaris,"Hyperkeratosis pilaris (keratosis pilaris): common skin condition, prevalence ~50 per 100k or higher in general population."
C4087124,,0.7,,56000,0.65,incidence,moderate,Kamisawa T et al. (2015). IgG4-related disease. Lancet. 385(9976):1460-1471,https://pubmed.ncbi.nlm.nih.gov/25480094/,high,False,,IgG4-related disease is a rare systemic immune-mediated disorder with incidence estimated at 0.5-1.0 per 100k per year in developed countries. Using 0.7 as global average estimate based on regional studies.
C4225184,,extremely rare,,extremely rare,0.3,incidence,weak,,,unknown,True,Lymphatic malformation,Specific genetic subtype of lymphatic malformation. <0.1 per 100k births based on molecular genetics case series.
C4225229,,extremely rare,,extremely rare,0.2,,none,,,unknown,True,Genetic Syndromic Cleft Palate,Rare genetic syndrome with compound features. Described in limited case reports. Specific incidence unknown; extremely rare presentation combining cleft palate with developmental delay and facial dysmorphism.
