,,,,,,,,,,,,,
C1835265,,extremely rare,,extremely rare,0.25,incidence,weak,,,unknown,False,,"Lymphedema, microcephaly and chorioretinopathy syndrome (compound genetic syndrome) extremely rare; <0.01 per 100k."
C1835662,,extremely rare,,extremely rare,0.2,incidence,weak,,,unknown,True,Palmoplantar keratoderma,"Rare keratoderma variant with papillous morphology. Poorly characterized, <0.01 per 100k estimated from dermatology literature case reports."
C1835664,,0.1,,8000,0.35,incidence,weak,,,low,True,Tylosis,Rare genetic syndrome with extremely high esophageal cancer risk; incidence <0.1 per 100k based on case reports.
C1836199,,extremely rare,,extremely rare,0.25,incidence,weak,,,high,True,Non-syndromic Recessive Deafness,DFB48 (DFNB48) is one of >100 genetic forms of non-syndromic recessive deafness. No specific epidemiological data available for this rare subtype. Genetic heterogeneity and variable distribution across populations. <0.1 per 100k estimated based on Mendelian inheritance patterns.
C1836206,,0.8,,64000,0.45,incidence,moderate,"Birth defects registries, orthopedic literature on hand malformations",,low,True,Syndactyly,Mesoaxial synostotic syndactyly with phalangeal reduction is a specific subtype of syndactyly. Overall syndactyly incidence ~1-2 per 100k births; this specific complex form estimated at ~0.8 per 100k births based on classification studies.
C1836373,,extremely rare,,extremely rare,0.3,incidence,weak,,,unknown,True,Limb-girdle muscular dystrophy,Rare autosomal recessive limb-girdle muscular dystrophy subtype due to POMT1 gene mutations. <0.1 per 100k births based on case reports.
C1836395,,extremely rare,,extremely rare,0.25,incidence,weak,,,unknown,True,Spinocerebellar Ataxia,"Spinocerebellar ataxia type 26 (SCA26) is an ultra-rare genetic neurological disorder. Only a few families reported in medical literature, estimated incidence <0.001 per 100k births. Autosomal dominant inheritance, but extremely limited epidemiological data. Confidence reflects extreme rarity and molecular genetic specificity with minimal population surveillance."
C1836602,,extremely rare,,extremely rare,0.3,incidence,weak,,,unknown,True,Bruck syndrome,"Rare genetic disorder characterized by contractures and osteogenesis imperfecta features. Type 2 is specific subtype. <50 cases documented worldwide, <0.01 per 100k."
C1836876,,extremely rare,,extremely rare,0.15,incidence,weak,,,unknown,False,,"Extremely rare genetic syndromic disease (LAMB3 mutation). Congenital nephrotic syndrome with ocular abnormalities, <10 cases reported worldwide."
C1837552,,0.08,,6400,0.32,incidence,weak,,,unknown,True,Charcot-Marie-Tooth disease type 2,CMT2L is rare genetic subtype of axonal CMT. Estimated ~0.08 per 100k based on CMT genetic registries.
C1837615,,0.1,3.5,280000,0.35,prevalence,weak,,,moderate,True,Primary Ciliary Dyskinesia,"Type 5 is a specific genetic subtype of primary ciliary dyskinesia (PCD). PCD overall prevalence estimated at 1-2 per 100k births, but specific type 5 distribution unknown. Using aggregate PCD prevalence ~3.5 per 100k with reduced confidence."
C1837805,,0.02,,1600,0.35,incidence,weak,,,low,True,Charcot-Marie-Tooth disease,Rare autosomal dominant CMT axonal subtype. Type 2G is one of the rarer CMT 2 subtypes. Estimated incidence ~0.02 per 100k based on genetic prevalence studies. Limited epidemiological incidence data for this specific subtype.
C1837893,,1.5,350,120000,0.45,both,moderate,Clinical studies of familial schizophrenia,,moderate,True,Schizophrenia,"Genetic schizophrenia subtype associated with chromosome 8p region. Reported incidence ~1-2 per 100k person-years for familial early-onset form. Overall schizophrenia prevalence ~350 per 100k, but specific genetic subtype comprises small fraction."
C1838654,,,,,0.0,,none,,,unknown,False,,"This syndrome appears unmappable: no significant epidemiological literature found, possibly extremely rare genetic syndrome with insufficient case series data for estimation. Requires verification of disease name and clinical definition."
C1839264,,0.5,,,0.4,prevalence,weak,,,low,True,Spastic Paraplegia,"Spastic paraplegia 2 (X-linked): rare neurological condition, estimated <1 per 100k."
C1839736,,extremely rare,,extremely rare,0.2,incidence,weak,,,unknown,False,X-Linked Intellectual Disability,"Extremely rare X-linked condition characterized by intellectual disability, facial dysmorphism, and skeletal abnormalities. Only a few families documented in literature, estimated <0.05 per 100k males."
C1842090,,extremely rare,,extremely rare,0.2,incidence,weak,,,unknown,True,Platelet Disorder,Rare inherited platelet disorder; <50 cases reported globally. Incidence <0.01 per 100k births. Based on case reports and genetic registries.
C1842704,,extremely rare,,extremely rare,0.4,incidence,weak,,,unknown,True,Gaucher Disease,"Perinatal lethal form (Type III) of Gaucher disease is extremely rare, with <50 cases reported globally. Global Gaucher incidence ~1-2 per 100k, but perinatal lethal represents <1% of cases, estimated <0.01 per 100k births. Mainly documented through case reports."
C1842870,,16.0,,1280000,0.5,incidence,moderate,,,low,True,Chromosomal Deletion Syndromes,"Rare chromosomal deletion disorder. Birth prevalence estimated at 1 in 5,000-6,000 live births (16-20 per 100k births). Limited epidemiological literature; most data from clinical case series and registry studies. Reporting as incidence per 100k births since this is a congenital condition."
C1843183,,0.02,,1600,0.35,incidence,weak,,,low,True,Charcot-Marie-Tooth disease,Rare autosomal recessive CMT subtype. CMT overall affects ~1 in 2500 people; Type 4A represents small fraction. Estimated incidence ~0.02 per 100k based on subtype prevalence data. Low confidence due to limited incidence studies for specific CMT subtypes.
C1844887,,extremely rare,,extremely rare,0.25,incidence,weak,,,unknown,False,Skeletal Dysplasia,"Extremely rare autosomal dominant skeletal dysplasia characterized by micrognathia, glossoptosis, and cleft palate. <50 documented cases worldwide, estimated <0.01 per 100k births."
C1845285,,0.02,,1600,0.18,incidence,weak,,,unknown,False,,Martin-Probst syndrome is extremely rare X-linked syndrome with hearing loss and intellectual disability. Estimated <0.05 per 100k based on <20 reported families worldwide.
C1845408,,extremely rare,,extremely rare,0.2,incidence,weak,,,unknown,True,X-linked Adrenoleukodystrophy,Extremely rare X-linked contiguous gene deletion syndrome involving ABCD1 and DXS1375E. <0.01 per 100k births estimated from case reports. Very limited published epidemiological data.
C1846265,,extremely rare,,extremely rare,0.15,,weak,,,unknown,True,Microphthalmia Syndromes,"Rare genetic developmental disorder affecting eye development, syndromic microphthalmia type 2 <100 cases, <0.01 per 100k births."
C1846431,,extremely rare,,extremely rare,0.25,incidence,weak,,,unknown,False,,"Rare autosomal recessive skeletal dysplasia characterized by progressive dwarfism, brachydactyly, and joint stiffness. Fewer than 50 cases reported in medical literature."
C1846722,,0.03,,2400,0.15,incidence,weak,,,unknown,False,,"Extremely rare syndrome combining macrocephaly, skeletal dysplasia, and facial dysmorphism. Estimated <0.05 per 100k based on very limited case reports."
C1847360,,,extremely rare,extremely rare,0.25,prevalence,weak,,,unknown,True,Parkinson Disease,"PARK10 is a rare genetic form of Parkinson's disease with autosomal recessive inheritance. Very few families documented worldwide, estimated <0.01 per 100k population. Confidence limited by minimal epidemiological data; reported as prevalence for chronic neurodegenerative condition."
C1847406,,extremely rare,,extremely rare,0.2,incidence,weak,,,unknown,True,Brachydactyly,Rare familial genetic disorder of digits characterized by brachydactyly and arthropathy. Estimated <0.1 per 100k; only scattered case reports available.
C1847554,,0.1,1,80000,0.4,both,weak,,,low,True,Primary Ciliary Dyskinesia,PCD2 is a rare genetic form of primary ciliary dyskinesia. Overall PCD prevalence ~1 per 100k; PCD2 represents subset due to specific gene mutations.
C1847800,,2.5,,200000,0.68,incidence,moderate,Genetic disorder epidemiology literature; birth defect registries,,low,True,Waardenburg Syndrome,"Waardenburg Syndrome Type 1 is an autosomal dominant genetic disorder affecting pigmentation and hearing. Type 1 represents approximately 1 in 40,000 births (2.5 per 100k births). Incidence estimate based on population-level genetic prevalence data from multiple registries."
C1848392,,extremely rare,,extremely rare,0.2,prevalence,weak,,,unknown,False,,"Rare genetic syndrome; fewer than 10 families reported in literature. Combines cleft palate, congenital heart disease, hypospadias, and other features. Estimated <0.01 per 100k births."
C1848600,,extremely rare,,extremely rare,0.2,incidence,weak,,,unknown,True,VATER Association,VATER association with hydrocephalus is a rare variant combining vertebral-anal-cardiac-tracheoesophageal-renal-limb anomalies with central nervous system involvement (hydrocephalus). Base VATER incidence is 1-2 per 100k births; association with hydrocephalus represents a small subset of cases.
C1849678,,extremely rare,,extremely rare,0.25,incidence,weak,,,unknown,True,Peroxisomal disorder,Extremely rare autosomal recessive peroxisomal disorder. Fewer than 20 cases reported worldwide. Estimated <0.01 per 100k births based on case report frequency.
C1850303,,extremely rare,,extremely rare,0.25,incidence,weak,,,unknown,True,Progressive External Ophthalmoplegia,"Rare mitochondrial disorder with autosomal recessive inheritance. mtDNA deletions with mitochondrial inheritance is extremely rare, estimated <0.1 per 100k births. Limited epidemiological data available; confidence based on case report frequency and disease rarity."
C1850959,,4.0,,320000,0.58,incidence,weak,,,high,True,Fuchs Endothelial Corneal Dystrophy,"FECD-1 is a specific genetic variant of Fuchs dystrophy. Estimated ~4 per 100k incidence in European populations, lower in other ancestry groups. Confidence limited by sparse epidemiological data for specific genetic subtypes."
C1853354,,extremely rare,,extremely rare,0.15,prevalence,weak,,,unknown,True,Peeling skin syndrome,"Very rare genetic disorder with acral keratoderma and peeling, fewer than 50 cases reported worldwide. Estimated <0.01 per 100k based on case reports and genetic databases."
C1853623,,extremely rare,0.1,extremely rare,0.2,prevalence,weak,,,unknown,False,,"Very rare genetic disorder (<50 cases reported worldwide). Only identified from case reports, no population-based epidemiological data available."
C1853995,,0.5,,40000,0.35,incidence,weak,,,unknown,True,Benign familial infantile seizures,Specific genetic subtype of benign familial infantile seizures (BFIS). Estimated incidence ~0.5 per 100k births. Limited epidemiological literature; confidence limited by sparse data on this rare genetic seizure variant.
C1854630,,extremely rare,,extremely rare,0.25,incidence,weak,,,unknown,False,,"Descriptive phenotypic combination of growth deficiency, intellectual disability, and facial dysmorphism that could encompass multiple rare genetic syndromes (primordial dwarfism with ID, Seckel syndrome variants, etc.). Overall phenotype estimated at <0.1 per 100k. Low confidence due to lack of specificity and heterogeneous underlying etiologies."
C1855722,,extremely rare,0.5,extremely rare,0.3,prevalence,weak,,,unknown,True,Iris Coloboma,"Multi-system rare genetic syndrome. Iris coloboma with ptosis and mental retardation is very rare, estimated <0.5 per 100k births based on case reports."
C1856718,,extremely rare,,extremely rare,0.15,prevalence,weak,,,unknown,True,Retinal dystrophies,"Rare benign familial retinal condition. Prevalence estimated <0.001 per 100k based on ophthalmological case reports. Often asymptomatic, underreported in epidemiological surveys."
C1857512,,extremely rare,,extremely rare,0.22,,weak,,,unknown,False,,"Temtamy syndrome is a rare autosomal recessive genetic disorder with skeletal dysplasia, cardiac abnormalities, and hearing loss. Extremely rare with <100 known cases worldwide. Incidence <0.01 per 100k based on case report frequency."
C1857690,,0.15,,12000,0.5,incidence,moderate,Pulmonary vascular disease epidemiology,,low,False,,PAVM including acquired and congenital forms. ~0.15 per 100k estimated from combined registries and HHT population data.
C1858051,,0.05,2,4000,0.3,incidence,weak,,,high,True,Cirrhosis,"North American Indian Childhood Cirrhosis (NAICC) is a rare genetic cholestatic disease identified in First Nations populations. Estimated incidence ~0.05 per 100k globally, much higher in specific indigenous communities. Limited epidemiological data."
C1858106,,0.05,,4000,0.25,incidence,weak,,,unknown,True,Hereditary Spastic Paraplegia,"Rare genetic neurological disorder. HSP type 12 (ARG1 mutation) extremely rare, estimated <0.1 per 100k based on genetic registries."
C1858338,,extremely rare,,extremely rare,0.3,prevalence,weak,,,high,True,Hereditary motor and sensory neuropathy,"Rare genetic variant of HMSN specific to Okinawan populations. Fewer than 100 cases documented worldwide. <0.01 per 100k globally, higher in Okinawa. Extremely limited epidemiological data."
C1858501,,extremely rare,,extremely rare,0.25,prevalence,weak,,,unknown,True,Spinocerebellar Ataxia,"SCA12 is a rare genetic disorder, extremely rare globally with fewer than 50 families reported. Estimated <0.01 per 100k based on case reports and pedigree studies."
C1858565,,120,,9600000,0.6,incidence,moderate,Privett JT et al. (1976). The incidence and importance of renal duplication. Clin Radiol. 27(4):521-530,https://pubmed.ncbi.nlm.nih.gov/1000667/,low,True,Congenital anomalies of kidney and ureter,Duplicated collecting system is essentially the same condition as double ureter; occurs in ~1 in 125-500 births (~120 per 100k births).
C1859564,,0.2,1.0,80000,0.55,prevalence,moderate,Forsythe E et al. (2008). Bardet-Biedl syndrome: a genetic update. Hum Mutat. 29(11):1344-1351,https://pubmed.ncbi.nlm.nih.gov/18951461/,moderate,True,Bardet-Biedl syndrome,"BBS is rare ciliopathy with prevalence ~1-2 per 100k globally. BBS3 (BBS-associated gene 3) is one of 21+ known genotypes, accounting for ~3-5% of BBS cases. Global prevalence estimated at 0.03-0.1 per 100k for BBS3 specifically."
C1859727,,extremely rare,,extremely rare,0.3,incidence,weak,,,unknown,True,Arterial Calcification,"Arterial calcification of infancy (ACI) is an extremely rare genetic disorder, <0.01 per 100k births. Autosomal recessive inheritance with limited epidemiological data."
C1860339,,0.2,,16000,0.5,incidence,moderate,,,moderate,True,Waardenburg Syndrome,"Waardenburg syndrome type IIA is a genetic disorder affecting pigmentation and hearing. Combined WS incidence estimated 1-3 per 100k births globally; type IIA represents ~5-10% of WS cases, estimated ~0.1-0.3 per 100k."
C1860850,,extremely rare,,extremely rare,0.25,incidence,weak,,,unknown,True,Trichodiscoma,Familial multiple trichodiscomas is an extremely rare hereditary condition involving benign skin tumors. Fewer than 50 families reported in medical literature; estimated <0.01 per 100k births.
C1861313,,extremely rare,,extremely rare,0.18,,none,,,unknown,True,Skeletal Dysplasia,"Ultra-rare skeletal dysplasia with specific combination of carpal synostosis, elbow joint dysplasia, and brachydactyly. Described in isolated case reports only. No systematic epidemiological surveillance exists."
C1861799,,extremely rare,,extremely rare,0.2,,weak,,,unknown,False,Alopecia,Extremely rare genetic condition involving congenital absence or severe reduction of scalp hair. <0.001 per 100k births based on limited case reports in dermatology literature. No systematic epidemiological data available.
C1862177,,,,,0.0,,none,,,unknown,False,,"Umbrella term combining skeletal dysplasia with soft tissue sarcoma, too heterogeneous to estimate meaningfully. Compound rare condition without systematic epidemiological data."
C1862373,,0.05,,4000,0.18,incidence,weak,,,unknown,True,Axenfeld-Rieger syndrome,Extremely rare complex syndrome combining Axenfeld-Rieger anomaly with multiple additional features. Estimated <0.1 per 100k based on very limited case reports.
C1863557,,extremely rare,,extremely rare,0.25,incidence,weak,,,unknown,True,Developmental Disorder,"Extremely rare genetic syndrome with developmental abnormalities, <5 cases reported in medical literature worldwide, <0.01 per 100k."
C1863678,,extremely rare,,extremely rare,0.15,incidence,weak,,,unknown,False,,"Compound rare condition: Craniosynostosis incidence ~1-3 per 10,000 births (~100-300 per 100k births), Ectopia lentis (~3-4 per 100k births). The combination is extremely rare, likely <0.01 per 100k due to distinct genetic etiologies. No systematic data for co-occurring conditions."
C1863732,,extremely rare,,extremely rare,0.25,incidence,weak,,,unknown,True,Spondyloepimetaphyseal Dysplasia,"Very rare genetic skeletal disorder with severe joint instability, <50 cases reported in literature, <0.001 per 100k births."
C1863844,,extremely rare,,extremely rare,0.25,incidence,weak,,,unknown,True,Citrullinemia,"Extremely rare autosomal recessive urea cycle disorder, type 2 (CPS1 deficiency). Fewer than 100 cases reported worldwide, estimated <0.01 per 100k births."
C1864497,,extremely rare,,extremely rare,0.3,incidence,weak,,,unknown,True,Psoriasis,Specific genetic subtype of psoriasis. Molecular subclassification with limited epidemiological data. <0.1 per 100k births.
C1864900,,extremely rare,0.1,extremely rare,0.18,prevalence,weak,,,unknown,True,Retinal Cone Dystrophy,"Specific genetic form (3A) of retinal cone dystrophy, an extremely rare inherited retinal degeneration. Cone dystrophies are estimated <0.1-1 per 100k, with individual genetic subtypes substantially rarer. Insufficient population-based epidemiological data."
C1865295,,0.05,,4000,0.25,incidence,weak,,,unknown,False,,Auriculo-condylar syndrome (question mark ear syndrome) is extremely rare craniofacial disorder. Estimated <0.1 per 100k based on <100 reported cases worldwide.
C1865322,,extremely rare,,extremely rare,0.35,incidence,weak,,,unknown,True,Familial Hemiplegic Migraine,"Genetic form FHM2 with CACNA1A mutations. Extremely rare, <0.01 per 100k. Only isolated case reports and small family pedigrees documented."
C1865818,,0.08,,6400,0.3,incidence,weak,,,unknown,True,Dystonia,DYT7 (early-onset torsion dystonia) is rare genetic form. Overall genetic dystonia ~5-10% of all dystonia. DYT7 represents small fraction; estimated <0.1 per 100k based on limited family reports.
C1865819,,1.2,,96000,0.55,incidence,moderate,,,low,True,Dystonia,Cervical dystonia (torticollis) is most common focal dystonia; incidence ~1-2 per 100k annually. Primary form excludes secondary causes. Data primarily from clinical cohorts and registry studies.
C1866070,,2.0,,160000,0.5,incidence,moderate,Mossey PA et al. (2009). Cleft lip and palate. Lancet. 374(9703):1773-1785,,high,True,Orofacial Cleft,"Orofacial Cleft 10 (OFC10) is a genetic subtype of orofacial cleft disorders. Overall orofacial cleft incidence is approximately 1 in 500-1000 live births (10-20 per 100k globally, with variation). OFC10 represents one of multiple genetic subtypes. Estimated incidence ~1-3 per 100k based on genetic classification. Geographic and ethnic variation significant."
C1866095,,extremely rare,,extremely rare,0.25,incidence,weak,,,unknown,True,Autosomal Dominant Hearing Loss,"Rare genetic form of hearing loss, specific DFNA13 subtype, <0.1 per 100k based on molecular genetic studies and limited family-based epidemiology."
C1868682,,extremely rare,,extremely rare,0.35,incidence,weak,,,unknown,False,Paroxysmal Movement Disorders,"Rare genetic channelopathy, autosomal dominant inheritance. Estimated <0.1 per 100k based on case reports and family studies."
C1876165,,0.05,0.3,24000,0.35,prevalence,weak,,,high,True,Cirrhosis,Copper-overload cirrhosis includes Wilson's disease and other rare copper storage disorders causing cirrhosis. Wilson's disease prevalence approximately 0.3-3 per 100k globally with significant geographic variation. Estimate 0.3 per 100k as average.
C1882620,,,,,0.0,,none,,,unknown,False,,"This appears to be an animal model disease term (cholangiofibrosis in rats), not a human disease. Not applicable for human disease incidence mapping."
C1954751,,,,,0.0,,none,,,unknown,False,,"Umbrella term covering dozens of distinct microdeletion syndromes (22q11.2 deletion, 1p36 deletion, Williams, Prader-Willi, etc.) with vastly different incidence rates. Too heterogeneous to estimate meaningfully."
C1955760,,0.8,,64000,0.5,incidence,weak,,,unknown,False,,"Rare neurodegenerative condition presenting with classic triad: gait disturbance, urinary incontinence, cognitive decline. Primarily affects elderly (>60 years). Incidence estimates from limited literature range 0.3-1.4 per 100k per year; using conservative midpoint estimate of 0.8 per 100k. Limited large-scale epidemiological studies available."
C1956093,,,0.05,4000,0.25,prevalence,weak,,,unknown,True,Thrombocytopenia with Giant Platelets,Rare genetic disorder with autosomal dominant inheritance affecting platelet formation and cardiac development. Extremely rare with estimated prevalence <0.1 per 100k based on case reports. No population-based epidemiological studies found.
C1969342,,0.1,,8000,0.3,incidence,weak,,,low,True,"Pulmonary Hypertension, Primary",Drug-induced pulmonary hypertension from dexfenfluramine use (withdrawn in 1997). Very rare; estimated <0.1 per 100k based on historical case reports and cohort studies of fenfluramine-associated PH patients.
C1969343,,0.2,,16000,0.35,incidence,weak,,,low,True,"Pulmonary Hypertension, Primary",Fenfluramine-associated pulmonary hypertension; rare adverse effect from appetite suppressant use (fenfluramine withdrawn in 1997). Estimated ~0.2 per 100k based on published cohorts of affected patients.
C1969653,,extremely rare,,extremely rare,0.15,prevalence,weak,,,unknown,False,,Extremely rare genetic disorder. Fewer than 10 reported cases globally. <0.01 per 100k.
C1970027,,0.03,,2400,0.15,incidence,weak,,,unknown,False,,Extremely rare complex syndrome with multiple craniofacial and skeletal features. Estimated <0.05 per 100k based on very limited case reports.
C1970107,,,1.5,120000,0.35,prevalence,weak,,,unknown,True,Spastic ataxia,Autosomal dominant spastic ataxia type 1 (SPAX1) is a rare genetic neurological disorder. Limited epidemiological data available; prevalence estimated at 1-2 per 100k based on clinical genetics cohorts and family studies.
C1970179,,extremely rare,,extremely rare,0.2,,none,,,unknown,True,Autosomal Recessive Mental Retardation,Extremely rare genetic condition (AR-MR4). No systematic epidemiological data available. Estimated <0.01 per 100k births based on genetic disorder prevalence patterns.
C1970193,,extremely rare,,extremely rare,0.2,,none,,,unknown,True,Autosomal Recessive Mental Retardation,Extremely rare genetic condition (AR-MR11). No systematic epidemiological data available. Estimated <0.01 per 100k births based on genetic disorder prevalence patterns.
C1970194,,extremely rare,,extremely rare,0.15,incidence,weak,,,unknown,True,"Intellectual Disability, Autosomal Recessive",Extremely rare genetic condition with autosomal recessive inheritance. Estimated at <0.01 per 100k based on limited case reports. No systematic epidemiological studies available.
C1970195,,extremely rare,,extremely rare,0.15,incidence,weak,,,unknown,True,"Intellectual Disability, Autosomal Recessive",Extremely rare genetic condition with autosomal recessive inheritance. Estimated at <0.01 per 100k based on limited case reports. No systematic epidemiological studies available.
C2047886,,0.8,,64000,0.5,incidence,weak,,,unknown,False,,Appears to be alternate CUI coding for idiopathic normal pressure hydrocephalus (same clinical entity as C1955760). Rare neurodegenerative condition with classic triad affecting primarily elderly patients. Incidence estimates 0.3-1.4 per 100k per year from limited studies; conservative estimate 0.8 per 100k. Limited epidemiological data available.
C2062713,,0.5,,40000,0.35,incidence,weak,,,moderate,False,Neuromuscular disorders,"Progressive External Ophthalmoplegia (PEO) and related disorders, estimated 0.5-1 per 100k incidence based on mitochondrial disease registries. Limited epidemiological data for this specific presentation."
C2076596,,0.005,,400,0.65,incidence,moderate,WHO Global Influenza Surveillance and Response System,https://www.who.int/initiatives/global-influenza-surveillance-and-response-system,high,True,Influenza,"H5N1 pandemic strain, sporadic human cases globally. WHO data shows ~100-400 confirmed cases annually worldwide (0.001-0.005 per 100k). Limited to poultry handlers and endemic regions."
C2188153,,3.5,,280000,0.28,incidence,weak,,,high,False,,"Umbrella term for soft tissue sarcomas of undifferentiated histology. Aggregate BOTEC estimate summing: leiomyosarcoma (~1.0), synovial sarcoma (~0.5), rhabdomyosarcoma (~1.0), unclassified/NOS subtypes (~1.0) = ~3.5 per 100k. Low confidence due to heterogeneity and overlap."
C2242539,,8.5,,680000,0.45,incidence,moderate,,,high,True,Skin and Soft Tissue Infection,"Subcutaneous infections (abscess, cellulitis of subcutaneous tissues) estimated at ~8.5 per 100k based on emergency department surveillance and hospitalization data, but population-level incidence varies by healthcare setting."
C2242703,,15.0,,1200000,0.55,incidence,moderate,,,high,False,,Cardio-renal syndrome (simultaneous heart and kidney dysfunction) estimated ~15 per 100k in at-risk populations.
